{
  "$schema": "https://json-schema.org/draft/2020-12/schema",
  "$id": "https://schemas.lagovista.com/auth/auth-view.schema.json",
  "title": "Canonical AuthView",
  "type": "object",
  "additionalProperties": false,
  "required": [
    "$schema",
    "schemaVersion",
    "viewId",
    "name",
    "category",
    "routeId",
    "status",
    "controls",
    "actions",
    "platforms"
  ],
  "properties": {
    "$schema": { "type": "string" },
    "schemaVersion": { "const": "1.0" },
    "viewId": { "$ref": "#/$defs/authKey" },
    "name": { "type": "string", "minLength": 1, "maxLength": 160 },
    "description": { "type": "string", "minLength": 1, "maxLength": 1000 },
    "category": {
      "type": "string",
      "enum": [
        "entry",
        "password",
        "provider",
        "passkey",
        "totp",
        "recovery",
        "registration",
        "invitation",
        "email-verification",
        "organization",
        "session"
      ]
    },
    "routeId": { "$ref": "#/$defs/authKey" },
    "status": {
      "type": "string",
      "enum": ["proposed", "active", "deprecated", "retired"]
    },
    "viewStates": {
      "type": "object",
      "additionalProperties": false,
      "required": ["defaultState", "states"],
      "properties": {
        "defaultState": { "$ref": "#/$defs/viewStateKey" },
        "states": {
          "type": "array",
          "minItems": 1,
          "uniqueItems": true,
          "items": { "$ref": "#/$defs/viewStateKey" }
        }
      },
      "description": "Optional presentation-only state contract. Exactly one listed state is active when the view is rendered. It controls deterministic UI presentation and runner-observable state only; it must never define or replace authentication, authorization, tenant, or domain state."
    },
    "controls": {
      "type": "array",
      "items": { "$ref": "#/$defs/control" }
    },
    "actions": {
      "type": "array",
      "items": { "$ref": "#/$defs/action" }
    },
    "platforms": {
      "type": "object",
      "additionalProperties": false,
      "required": ["web", "mobile"],
      "properties": {
        "web": { "$ref": "#/$defs/platformSupport" },
        "mobile": { "$ref": "#/$defs/platformSupport" }
      }
    },
    "source": {
      "type": "object",
      "additionalProperties": false,
      "properties": {
        "runtimeEntityId": { "type": "string", "minLength": 1 },
        "runtimeSha256Hex": { "type": "string", "pattern": "^[a-f0-9]{64}$" },
        "webComponent": { "type": "string", "minLength": 1 },
        "mobileComponent": { "type": "string", "minLength": 1 }
      }
    },
    "notes": {
      "type": "array",
      "items": { "type": "string", "minLength": 1 }
    }
  },
  "$defs": {
    "authKey": {
      "type": "string",
      "pattern": "^auth\\.[a-z][a-z0-9-]{1,63}(\\.[a-z][a-z0-9-]{1,63})*$"
    },
    "identifier": {
      "type": "string",
      "pattern": "^[a-z][a-z0-9]*(?:-[a-z0-9]+)*$",
      "minLength": 2,
      "maxLength": 96
    },
    "viewStateKey": {
      "type": "string",
      "pattern": "^[a-z][a-z0-9]*(?:-[a-z0-9]+)*$",
      "minLength": 2,
      "maxLength": 96
    },
    "viewStateKeys": {
      "type": "array",
      "minItems": 1,
      "uniqueItems": true,
      "items": { "$ref": "#/$defs/viewStateKey" }
    },
    "finder": {
      "type": "string",
      "pattern": "^(screen|field|label|status|display|action):[a-z][a-z0-9]*(?:-[a-z0-9]+)*$"
    },
    "control": {
      "type": "object",
      "additionalProperties": false,
      "required": ["id", "name", "controlType", "finder"],
      "properties": {
        "id": { "$ref": "#/$defs/identifier" },
        "name": { "type": "string", "minLength": 1, "maxLength": 160 },
        "controlType": {
          "type": "string",
          "enum": [
            "text-input",
            "email-input",
            "password-input",
            "code-input",
            "checkbox",
            "select",
            "label",
            "status",
            "display",
            "qr-code",
            "secret-display",
            "copyable-value"
          ]
        },
        "finder": { "$ref": "#/$defs/finder" },
        "required": { "type": "boolean" },
        "sensitivity": {
          "type": "string",
          "enum": ["public", "personal", "credential", "secret"]
        },
        "visibilityCondition": { "type": "string", "minLength": 1 },
        "visibleInViewStates": {
          "$ref": "#/$defs/viewStateKeys",
          "description": "When present, the control is visible only while the AuthView is in one of these presentation states."
        },
        "enabledInViewStates": {
          "$ref": "#/$defs/viewStateKeys",
          "description": "When present, the control is enabled only while the AuthView is in one of these presentation states."
        }
      }
    },
    "action": {
      "type": "object",
      "additionalProperties": false,
      "required": ["id", "name", "actionType", "finder"],
      "properties": {
        "id": { "$ref": "#/$defs/identifier" },
        "name": { "type": "string", "minLength": 1, "maxLength": 160 },
        "actionType": {
          "type": "string",
          "enum": ["button", "link", "native-capability"]
        },
        "finder": { "$ref": "#/$defs/finder" },
        "visibilityCondition": { "type": "string", "minLength": 1 },
        "visibleInViewStates": {
          "$ref": "#/$defs/viewStateKeys",
          "description": "When present, the action is visible only while the AuthView is in one of these presentation states."
        },
        "enabledInViewStates": {
          "$ref": "#/$defs/viewStateKeys",
          "description": "When present, the action is enabled only while the AuthView is in one of these presentation states."
        }
      }
    },
    "platformConformance": {
      "type": "object",
      "additionalProperties": false,
      "required": ["status"],
      "properties": {
        "status": {
          "type": "string",
          "enum": ["verified", "needs-review", "mismatch", "not-applicable"]
        },
        "checkedUtc": { "type": "string", "format": "date-time" },
        "checkedAgainst": {
          "type": "array",
          "items": {
            "type": "string",
            "enum": ["view-identity", "view-state", "controls", "actions", "finders", "navigation"]
          },
          "uniqueItems": true
        },
        "notes": { "type": "string", "minLength": 1 }
      }
    },
    "platformSupport": {
      "type": "object",
      "additionalProperties": false,
      "required": ["status"],
      "properties": {
        "status": {
          "type": "string",
          "enum": ["implemented", "partial", "planned", "unsupported", "not-applicable"]
        },
        "repository": { "type": "string", "pattern": "^[A-Za-z0-9_.-]+/[A-Za-z0-9_.-]+$" },
        "path": { "type": "string", "minLength": 1 },
        "component": { "type": "string", "minLength": 1 },
        "implementation": { "type": "string", "minLength": 1 },
        "conformance": { "$ref": "#/$defs/platformConformance" },
        "notes": { "type": "string", "minLength": 1 }
      }
    }
  }
}
