{
  "$schema": "../schemas/auth-view.schema.json",
  "schemaVersion": "1.0",
  "viewId": "auth.password.reset.complete",
  "name": "Choose a New Password",
  "description": "Allows an anonymous user whose six-digit recovery code was successfully verified to choose and confirm a new password using reset authority held internally by the application flow.",
  "category": "recovery",
  "routeId": "auth.route.password.reset.complete",
  "status": "active",
  "controls": [
    {
      "id": "new-password",
      "name": "New Password",
      "controlType": "password-input",
      "finder": "field:new-password",
      "required": true,
      "sensitivity": "credential"
    },
    {
      "id": "confirm-password",
      "name": "Confirm Password",
      "controlType": "password-input",
      "finder": "field:confirm-password",
      "required": true,
      "sensitivity": "credential"
    },
    {
      "id": "validation-error",
      "name": "Validation Error",
      "controlType": "status",
      "finder": "status:validation-error",
      "sensitivity": "public"
    }
  ],
  "actions": [
    {
      "id": "reset-password",
      "name": "Reset Password",
      "actionType": "button",
      "finder": "action:reset-password"
    },
    {
      "id": "cancel",
      "name": "Cancel",
      "actionType": "button",
      "finder": "action:cancel"
    }
  ],
  "platforms": {
    "web": {
      "status": "partial",
      "repository": "softwarelogistics/nuviot-ui-shared",
      "path": "user/reset-password/reset-password.component.ts",
      "component": "ResetPasswordComponent",
      "implementation": "ResetPasswordComponent",
      "conformance": {
        "status": "mismatch",
        "checkedAgainst": ["view-identity", "controls", "actions", "finders", "navigation"],
        "notes": "The existing Angular form has the required password fields, but it obtains a reset code from the route and its reset operation remains a stub instead of consuming reset authority established by recovery-code verification."
      }
    },
    "mobile": {
      "status": "partial",
      "repository": "nuviot/vtm-client",
      "path": "app/auth/reset-password.tsx",
      "component": "AuthOutcomeScreen",
      "implementation": "AuthOutcomeScreen",
      "conformance": {
        "status": "mismatch",
        "checkedAgainst": ["view-identity", "controls", "actions", "finders", "navigation"],
        "notes": "The route exists but delegates to an outcome-only shell with no new-password or confirm-password controls and no password-reset operation."
      }
    }
  },
  "source": {
    "runtimeEntityId": "BB23CECB524D4103AFF320DCC5FF1590",
    "runtimeSha256Hex": "693e1151f6dc007e04feeda2a4b1c815115d066fe4658590376f56b8286b4dde",
    "webComponent": "ResetPasswordComponent",
    "mobileComponent": "AuthOutcomeScreen"
  }
}
