{
  "$schema": "../schemas/auth-view.schema.json",
  "schemaVersion": "1.0",
  "viewId": "auth.continue.email.password",
  "name": "Sign In with Password",
  "description": "Authenticates the submitted email and password or offers account recovery and a clear path back to the authentication welcome screen.",
  "category": "password",
  "routeId": "auth.route.continue.email.password",
  "status": "active",
  "controls": [
    { "id": "email", "name": "Email", "controlType": "email-input", "finder": "field:email", "required": true, "sensitivity": "personal" },
    { "id": "password", "name": "Password", "controlType": "password-input", "finder": "field:password", "required": true, "sensitivity": "credential" },
    { "id": "validation-error", "name": "Validation Error", "controlType": "status", "finder": "status:validation-error", "visibilityCondition": "validation-failed" }
  ],
  "actions": [
    { "id": "sign-in", "name": "Sign In", "actionType": "button", "finder": "action:sign-in" },
    { "id": "forgot-password", "name": "Forgot Password", "actionType": "link", "finder": "action:forgot-password" },
    { "id": "start-over", "name": "Start Over", "actionType": "link", "finder": "action:start-over" }
  ],
  "platforms": {
    "web": {
      "status": "implemented",
      "repository": "softwarelogistics/nuviot-ui-shared",
      "path": "user/email-login-password/email-login-password.component.ts",
      "component": "EmailLoginPasswordComponent",
      "implementation": "EmailLoginPasswordComponent with email-login-password.component.html",
      "conformance": {
        "status": "needs-review",
        "checkedUtc": "2026-08-11T19:52:00Z",
        "checkedAgainst": ["view-identity", "controls", "actions", "finders", "navigation"],
        "notes": "Canonical Password Entry now requires editable email and password inputs with sign-in, forgot-password, and start-over actions. Cancel is no longer part of the authored surface. Reconciliation should verify Start Over returns to auth.welcome."
      }
    },
    "mobile": {
      "status": "implemented",
      "repository": "nuviot/vtm-client",
      "path": "src/features/authentication/nuviot-account/screens/continue-email-password-screen.tsx",
      "component": "ContinueEmailPasswordScreen",
      "implementation": "app/auth/continue/email/password.tsx -> ContinueEmailPasswordScreen",
      "conformance": {
        "status": "mismatch",
        "checkedUtc": "2026-08-11T19:52:00Z",
        "checkedAgainst": ["view-identity", "controls", "actions", "finders", "navigation"],
        "notes": "Canonical Password Entry requires editable email and password inputs with sign-in, forgot-password, and start-over actions. The mobile surface still lacks the editable email field. Start Over must return to auth.welcome."
      }
    }
  },
  "source": {
    "runtimeEntityId": "AA236D1387824E3EA9FD4B7C0EF7CBBC",
    "runtimeSha256Hex": "dcee1aeb5ac78eb01b16c0844a7520867b4373076388097d62f76e5c44611781",
    "webComponent": "EmailLoginPasswordComponent",
    "mobileComponent": "app/auth/continue/email/password.tsx"
  },
  "notes": [
    "The legacy next action is normalized to sign-in.",
    "Magic Link is intentionally excluded from the V2 authentication behavior model.",
    "Validation copy is not part of the stable control identity.",
    "Email remains editable on Password Entry.",
    "Start Over replaces the ambiguous Cancel affordance and returns the user to auth.welcome."
  ]
}
