{
  "$schema": "../schemas/auth-view.schema.json",
  "schemaVersion": "1.0",
  "viewId": "auth.password.change.complete",
  "name": "Password Changed",
  "description": "Confirms that the authenticated user's password was changed successfully and provides a single action to leave the completion surface.",
  "category": "password",
  "routeId": "auth.route.password.change.complete",
  "status": "proposed",
  "controls": [
    {
      "id": "password-change-success",
      "name": "Password Changed Successfully",
      "controlType": "status",
      "finder": "status:password-change-success",
      "sensitivity": "public"
    }
  ],
  "actions": [
    {
      "id": "done",
      "name": "Done",
      "actionType": "button",
      "finder": "action:done"
    }
  ],
  "platforms": {
    "web": {
      "status": "planned",
      "notes": "Canonical completion surface discovered during Password Management scenario reconciliation."
    },
    "mobile": {
      "status": "planned",
      "notes": "Web and mobile should expose the same semantic confirmation and Done action."
    }
  },
  "notes": [
    "action:done leaves the password-change auth flow; the host-specific destination or navigation mechanism is intentionally owned by Angular, React Native, or the containing host.",
    "This view exists because a successful password change has a materially distinct completion presentation from a rejected password change."
  ]
}
