{
  "$schema": "../schemas/auth-view.schema.json",
  "schemaVersion": "1.0",
  "viewId": "auth.continue.totp",
  "name": "Continue with TOTP",
  "description": "Collects a one-time authenticator code for a known email identity and offers recovery-code, password fallback, and restart navigation.",
  "category": "totp",
  "routeId": "auth.route.continue.totp",
  "status": "active",
  "controls": [
    { "id": "email", "name": "Email", "controlType": "email-input", "finder": "field:email", "required": true, "sensitivity": "personal" },
    { "id": "verification-code", "name": "Verification Code", "controlType": "code-input", "finder": "field:verification-code", "required": true, "sensitivity": "credential" },
    { "id": "validation-error", "name": "Validation Error", "controlType": "status", "finder": "status:validation-error" }
  ],
  "actions": [
    { "id": "verify", "name": "Verify", "actionType": "button", "finder": "action:verify" },
    { "id": "use-recovery-code", "name": "Use a Recovery Code", "actionType": "link", "finder": "action:use-recovery-code" },
    { "id": "cancel", "name": "Cancel", "actionType": "button", "finder": "action:cancel" },
    { "id": "use-password", "name": "Use Password Instead", "actionType": "link", "finder": "action:use-password" },
    { "id": "start-over", "name": "Start Over", "actionType": "link", "finder": "action:start-over" }
  ],
  "platforms": {
    "web": {
      "status": "implemented",
      "repository": "softwarelogistics/nuviot-ui-shared",
      "path": "user/continue-totp/continue-totp.component.ts",
      "component": "ContinueTotpComponent",
      "implementation": "TOTP verification uses generated AuthClient.createTotpLogin with the password-issued MFA challenge. The canonical recovery-code action routes to auth.continue.recovery, and exit paths clear the challenge."
    },
    "mobile": {
      "status": "implemented",
      "repository": "nuviot/vtm-client",
      "path": "src/features/authentication/nuviot-account/screens/continue-totp-screen.tsx",
      "component": "ContinueTotpScreen",
      "implementation": "TOTP verification uses AuthContext.signInWithTotpAsync and generated AuthClient.createTotpToken with the in-memory password-issued MFA challenge. The canonical recovery-code action routes to /auth/continue/recovery."
    }
  },
  "source": {
    "runtimeEntityId": "B06EB750EA5B4142AD1F017896E1F474",
    "runtimeSha256Hex": "ac3c8a86afda0ed1b962984cd1277aaf1cd1b6935400bbe90d07ca23d8230977",
    "webComponent": "ContinueTotpComponent",
    "mobileComponent": "ContinueTotpScreen"
  },
  "notes": [
    "The implementation field id totp is normalized to verification-code.",
    "Validation copy is not used as a stable identifier.",
    "Both supported clients require the short-lived password-issued MFA challenge before TOTP proof can establish a session or token.",
    "Both stable clients consume generated Auth contracts from nuviot/nuvos-app-contracts commit 56f0679a24579937052d7bafb362fa2ef703910a."
  ]
}
